{
  "schemaVersion":"runtime-kernel-001",
  "rulesetVersion":"ss-rules-001",
  "contentVersion":"civic-seam-content-001",
  "arenaVersion":"civic-seam-arena-001",
  "seed":1,
  "commands":[
    {"tick":1,"moveX":32767,"moveY":0,"dodgePressed":false},
    {"tick":2,"moveX":32767,"moveY":0,"dodgePressed":false},
    {"tick":3,"moveX":0,"moveY":32767,"dodgePressed":true},
    {"tick":4,"moveX":0,"moveY":32767,"dodgePressed":false},
    {"tick":5,"moveX":0,"moveY":0,"dodgePressed":false}
  ]
}
